Date,Viewcount,Likes,Comments,Post Link,Description
12/25/2019,102,0,1,https://www.instagram.com/p/B6fbhQJgJRf/,"It's beginning to look a lot like Christmas! 🎄 We wish you happy holidays. Thank you for following us. See you next year? On to a sustainable, inclusive and happy digital future! 🥂"
12/23/2019,229,0,2,https://www.instagram.com/p/B6aR8fyHqn9/,"""I really like the environment of working with people from all over the world"" - Jake, former coding Trainee at Digital Society School. And we are happy that Jake is still with us as a colleague "
12/17/2019,9,0,1,https://www.instagram.com/p/B6K_7YVF8Ov/,Printing prototypes! 
12/16/2019,0,33,0,https://www.instagram.com/p/B6IDW_WFSpX/,・ ・ ・ Defining the impact of innovative solutions through systemic design 
12/13/2019,0,9,1,https://www.instagram.com/p/B6BZBsGFNB3/,Do you dare to sign up on Fakebook? Data is the new oil! Our students created a little reality check for you. Check it all out on the Updates page on our website. Link in bio.
12/12/2019,8,0,2,https://www.instagram.com/p/B599MuyJYHD/,"As humans we all live in different bubbles, defined by your interests, family, work, etc. In what bubble do you live? ;-)"
12/11/2019,224,0,1,https://www.instagram.com/p/B57YZSYD0UX/,What the * beep *! do you do guys? ;-) Take a look in our studio and check it out. And a flashback to the warm summer days! 🔥
12/10/2019,0,22,1,https://www.instagram.com/p/B55qpc-lrNv/," Can you imagine a world without birds, insects and bees? 70% of crops used directly for human consumption are dependent on these pollinators. The Urban Ecosystems team (Digital to Physical Track) has been investigating new ways to increase public awareness about the significance of pollinators and biodiversity in Amsterdam. Read about it on our website! Link in bio."
12/9/2019,0,25,1,https://www.instagram.com/p/B52OzkTgh2J/,Hey you! How's your mindset? 🧠 We live in a fast changing world. How to keep up with everything? Developing your own (adaptable) mindset will allow you to embrace and deal with change much more effectively in both your personal and professional life. ⛵️Enroll for free in our online course. See link in bio. 🔗
12/6/2019,2,0,1,https://www.instagram.com/p/B5u2vKlp16P/,"Technology is impacting our world. But does it contribute to a sustainable, responsible and inclusive society? At Digital Society School we believe we need a variety of people from different backgrounds and disciplines that understand the risks and possibilities of digital transformation to lead the transformation of society, to a sustainable future. Only together, we can do this! "
12/5/2019,5,0,1,https://www.instagram.com/p/B5sogyQlr1g/,"What is Speculative Design about ??? 🤔 It's about not focusing on problems in the present, but imagine how developments change over time and could affect the future! ✨ Learn critical thinking and create an adaptable mindset in our Speculative Design Course. Link in bio"
12/4/2019,0,37,1,https://www.instagram.com/p/B5pW082DjTb/,"While waiting on the printed version to be back, did you know you can find all cards of the Design Method Toolkit online? Check the link in our bio! "
12/3/2019,0,21,3,https://www.instagram.com/p/B5nIWMPDGeZ/,"If you could print everything you like, what would roll out of your printer?"
12/2/2019,0,25,1,https://www.instagram.com/p/B5kfoRDDiAn/,Today the Studio is stacked with tools and materials. Our trainees get a nifty prototyping workshop. Make us proud! 
12/2/2019,0,30,1,https://www.instagram.com/p/B5j4ox0A9F5/,Happy new week! What is your plan today?
12/2/2019,9,0,2,https://www.instagram.com/p/B5izvw9gUuC/,"Meet Barbara! ""Working with people from different cultures really learned that you learn the most from each other."""
11/29/2019,6,0,1,https://www.instagram.com/p/B5ckJzBDELw/,"Excited to announce that Design Across Cultures will start as a track in 2020! 👀We activate, empower and support organization around the world to work together across contexts, cultures and nations."
11/19/2019,223,0,1,https://www.instagram.com/p/B5CxTjrFqrk/,"Good luck to our colleague Dan Xu, who is presenting her poster today at # HTTP2019 ! "
11/15/2019,0,19,0,https://www.instagram.com/p/B45FePeF9Jl/,"At the Digital Society School, team Botanik is researching the efficacy of an automated conversational agent (or chatbot) to interact with perpetrators of online abuse and harassment.Their first experiment begins next week, and they'd like to have your feedback! Follow this link to find the chatbot, which will walk you through the feedback process step by step:botanik.dss.cloud Follow the project's twitter account:bot_botanik"
11/7/2019,0,27,0,https://www.instagram.com/p/B4kT5cLFnEj/,"Why meet inside, if you can also meet outside? With warm coats, we must admit!"
11/7/2019,0,31,2,https://www.instagram.com/p/B4j9xpvFDdi/,Question of the day! What does it mean to be fulfilled in a fast changing world? 
11/5/2019,0,29,0,https://www.instagram.com/p/B4ehDbOFd9F/,"The robots are here! 🤖You can visit the ""Deep Meaning (Critters)"" expo till November 10"
11/4/2019,0,16,1,https://www.instagram.com/p/B4cjzTBlo8e/,On saturday a group of@digitalsocietyschool trainees visited the @impaktfestival. We talked about the goals and the background of the Futurotheque.com project and I got some valuable questions and feedback on how to proceed with my speculative app store in the future. What else to expect from participants in the Digital to Physical track!
11/1/2019,0,41,0,https://www.instagram.com/p/B4UpiNjl-fz/,Summer is over. Luckily we have this amazing view when looking out of the window!
10/18/2019,0,28,1,https://www.instagram.com/p/B3wobm8lnsF/,Whatever you do
10/15/2019,157,0,1,https://www.instagram.com/p/B3pHlgAlMkz/,"Life is full of learning moments! 🤗 What is the next thing you would like to learn?Consider taking a look to our courses page. New courses will pop up the coming weeks. 🌱 Some courses you can follow online: wherever you are, whenever you want. 🏖 Only an internet connection is required"
10/11/2019,0,44,2,https://www.instagram.com/p/B3eRL__F7Mg/,Happy new brochure! 😁 Want to know what's inside? 
10/1/2019,0,42,3,https://www.instagram.com/p/B3Eay2SIeJF/,What do you like the most about our Digital Society? Let us know 
9/20/2019,0,65,2,https://www.instagram.com/p/B2obpMZFG0x/,
9/20/2019,0,39,0,https://www.instagram.com/p/B2oHuQrlEvV/,Yes! So happy to see you all jamming around the world. Thanks so much for sharing all your great footage. Today is also the start of the #globalgoalsjam Amsterdam.
9/11/2019,0,57,2,https://www.instagram.com/p/B2Q31wJIpv6/,"Look at this beautiful story of @lauraturqueto• We are the result of our choices and I decided to:1. be conscious about my impacts and take actions;2. invest my time and energy not in what it is, but what it can be;3. inspire people's behavior change towards a more responsible future;4. empower businesses to develop products, services or experiences which help society to live a more fulfilling and complete life;Live no one behind.I decided to be the change, embracing the Sustainable Development Goals -United Nation."
9/3/2019,0,69,0,https://www.instagram.com/p/B18f3yjI2Hd/,Our new wall reminds us of the goals it's all about: the Sustainable Development Goals!
9/2/2019,0,45,1,https://www.instagram.com/p/B16XNrFIKgH/,"Our new space @marineterrein_amsterdam is introduced by Wai and @gijsgootjesto our partners before the official opening party. Super happy to welcome our partners, new learners and friends today!"
8/28/2019,0,25,2,https://www.instagram.com/p/B1tAqMMoczi/,"Migration is one of the Global Goals Jam topics of this year.With the arrival of newcomers in a new country, challenges can arise. How do we make sure migration and mobility is done safe and responsibly, and procedures are fair and transparent? And how do we make sure that in the country of arrival everyone is included on a social, economic and political level, irrespective of age, sex, disability, race, ethnicity, origin, religion or economic or other status?"
8/26/2019,0,19,0,https://www.instagram.com/p/B1n8sj9o_1o/,"Water and Climate Change is one of the goals we will be working on during the #globalgoalsjam . 🐢🐠💦 How do we improve water quality and reduce pollution, increase water recycling and water reuse? How might we involve the local communities in improving water and sanitation management? How do we make sure there is (and will be) enough fresh water for everyone? And how do we prepare our cities and living environments for the results of climate change and water flooding on the one, or water scarcity on the other hand?"
8/23/2019,129,0,1,https://www.instagram.com/p/B1gG9cVouHc/,Are you ready for the #globalgoalsjam ? We are so happy and thankful with all participating cities and people! 👏🏼Bring it on! September 20-22
8/1/2019,0,51,0,https://www.instagram.com/p/B0nxo-6IfZM/,Sneak Peek 👀 Work in progress! 🔨 We can't wait to see our new office after summer 
7/23/2019,0,26,0,https://www.instagram.com/p/B0Qn3vDINML/,No better way to create new projects! 
7/16/2019,0,29,0,https://www.instagram.com/p/Bz-FmqgoVWV/,"During our #designacrosscultures summer school in collaboration with@makersunite.eu, 5 teams in the cities of Amsterdam 🇳🇱, Austin 🇺🇸, Milan 🇮🇹, Montevideo 🇺🇾 and Kyoto 🇯🇵 work on the challenges of migration. The teams will have their final presentations this friday at 15:00 at our studio in Amsterdam! If you are curious what has been created throughout the world, please come say hello 👋"
7/11/2019,257,0,1,https://www.instagram.com/p/BzxQVgrIJhT/,"Looking back at a semester at our school. Thank you Spring2019 semester!
"
6/27/2019,2,0,0,https://www.instagram.com/p/BzNwqrDoBf7/,"Are you ready for #outburst ? We will celebrate the most outstanding work in ICT, fashion, digital interactive design, media & communication. You are very welcome to join the activities. Check Outburst.Amsterdam for the full program."
6/26/2019,0,45,4,https://www.instagram.com/p/BzLQPstohoN/,Goodbye party for the learners of this semester. Almost ready to depart and make a nice boat trip through the canals of
6/20/2019,0,66,0,https://www.instagram.com/p/By7USoSoFKT/,Oh what a night! We really enjoyed the showcase.
6/20/2019,0,53,1,https://www.instagram.com/p/By53UNEI1yM/,"That's it! Thank you all for coming over to our showcase. We're proud of our learners, partners, ambassadors and friends! "
6/19/2019,0,37,5,https://www.instagram.com/p/By5Da-FoTqE/,Preparing for the showcase!
6/18/2019,0,38,0,https://www.instagram.com/p/By17UPpoQJ_/,Tomorrow is our #showcase and we can't wait! Today we will start rehearsing. Do we see you tomorrow?
6/17/2019,0,15,0,https://www.instagram.com/p/By0HyaUIRbm/,"CREATIVE CODERS NEEDED We are looking for talented * Data Scientists *, * Web Developers *, * Game Designers *, and * Hackers * to work on creative projects for the Digital Society School. The 20-week program is a chance to work with top companies and partners such a * Vodafone *, * ING *, * GGD * and * Police *. You will be presented with a unique opportunity to work with a creative team of designers, researchers and other senior creators. You will be trained on exciting new technologies such as blockchain, IoT, Machine Learning and AR / VR.YOU:- Are passionate about trying out new technology ✨ - Have an open mindset🤯- Wish to develop digital solutions to solve social issues 🔰- Are proficient in Web development frameworks (Angular, React, Express, Laravel, etc) and / or Machine Learning (R, Python, WEKA, etc), game development (Unity, UnReal Engine) 🛠- Are creative and fun-loving 👻WE OFFER:- A monthly stipend of 400 Euros 💸- An international, multicultural atmosphere🌍- A 20-week creative Bootcamp ✊🏽- Space dedicated at personal development - Daily Energizers, weekly snacks, and biweekly massage. 🤺- A chance to organize your own workshop 💡- Networking opportunities with the DSS community 🤝If that's you, we'd love to have you on board. The program starts in September 2019. Apply now: digitalsocietyschool.org/20-weeks-programme/"
6/14/2019,195,0,0,https://www.instagram.com/p/ByrjGPToSm9/,"Only 5 days till our showcase! 🥳 Interact with the talented learners, play with our digital installations, network with our partners and start conversations about how we can contribute to a positive transformation of society."
6/13/2019,0,31,1,https://www.instagram.com/p/BypFyPgovBH/,Posted @withrepost • @m4ri.creationsWireframes for a future plant app - the app connects to a sensor stick that measures what your plant needs and guides you in taking care of your favorite plant.
6/11/2019,0,44,0,https://www.instagram.com/p/Byk5YQmIbm9/,Shooting a new video today. We will show the results on the showcase on the 19th of June. Had lots of fun! How was your day?
6/3/2019,0,32,0,https://www.instagram.com/p/ByQLDjFI3V8/,We had a full house this weekend hosting the @uxcampamsterdam. Thanks all for joining us! 
5/29/2019,0,27,0,https://www.instagram.com/p/ByDdcxHIFxE/,Opening of
5/29/2019,0,19,2,https://www.instagram.com/p/ByDKA9_ogAr/,"What are you doing this summer? Join our fun, impactful and insightful “Migration Challenge” Summer School. Only 5 spots left! 👨🏼‍🎓👩🏽‍🎓 Check out our website in the bio for more information"
5/16/2019,0,27,0,https://www.instagram.com/p/BxhMGMGID1V/,"How can we use images in our research in a more meaningful way? You are welcome to join our next Mic Drop on June 12. Free entrance, drinks included. "
5/13/2019,167,0,0,https://www.instagram.com/p/BxZZpBhIp9W/,Let's start the week with printing stuff!
5/8/2019,0,53,4,https://www.instagram.com/p/BxMxzvXFphZ/,Say hello to Dan and Gijs! They're@acm_chiin Glasgow to present their posters
5/2/2019,0,23,0,https://www.instagram.com/p/Bw9Kzd2FnOG/,"""Everybody is saying: Robots are taking away my job. But if we design well, this will not happen. But, clearly we are getting scared."" - Cristina Zaga ⁣⠀"
4/30/2019,0,30,0,https://www.instagram.com/p/Bw1uDITFSIo/,No better start of the week than tweaking one of our
4/25/2019,0,39,0,https://www.instagram.com/p/BwrEqzOl1wJ/,"Recruiting for the new semester of our Digital Transformation intensive program has started! Are you interested in working on topics like climate change, health and well-being, inclusion or responsible consumption and production? Then join 🙏⁣⠀"
4/24/2019,0,34,1,https://www.instagram.com/p/BwoaV4nldD2/,Do you already know about our Digital Camps (workshops) on request? This one was about Teamwork Across Cultures for #Canon #Japan . Was fun with Zlatina and Evelien as teachers
4/23/2019,0,37,0,https://www.instagram.com/p/BwmXM0tFJJz/,"Beautiful day for an #energizer , isn't it? "
4/10/2019,7,0,1,https://www.instagram.com/p/BwFCBbgIp7s/,Getting ready for the Mic Drop by Cristina Zaga! 🙌🏼 You are still welcome to join ➡️ http://meetup.com/micdrops
4/8/2019,0,27,0,https://www.instagram.com/p/Bv_g0hsFW-U/,Only two more days till MIC DROP # 11 : Robothings for social good. Join us this Wednesday. Register via bit.ly/micdrop11
4/8/2019,0,35,1,https://www.instagram.com/p/Bv_fWKIlAhB/,What is happening here? We were exploring the future of identity and representation and how we can build better internet (s) for generations to come! 
4/2/2019,0,24,0,https://www.instagram.com/p/BvwZhPOl8ge/,What's going on today? 
4/1/2019,0,32,0,https://www.instagram.com/p/BvtBaMGlw1h/,Photo shoot time. Shine bright like a diamond! 💎 To be continued ... 
3/26/2019,0,27,2,https://www.instagram.com/p/Bveh6A8ILpr/,And another #workshop down! We got our hands dirty with LIFULL. 1 Ps team (1% of work and 1% of profit for #peace ) connecting 
3/25/2019,0,50,0,https://www.instagram.com/p/BvbrvBOlg15/, Thank you all for coming to the book launch of our first publication: 'in search of future - proof corporations' 📸Boudine Molenkamp
3/19/2019,0,46,0,https://www.instagram.com/p/BvMd72HlnDd/,Recorded a great #podcast today! Putting the power of our difference to work. 🙌🏼 To be published at MOOC. Stay tuned!
3/18/2019,0,40,2,https://www.instagram.com/p/BvJ4LSnlsac/,Today is the start of the Design Across Cultures meetup. 12 international experts from our Digital Society School network are in Amsterdam to jointly shape the future of our Design Across Cultures program and mission. 
3/12/2019,0,43,0,https://www.instagram.com/p/Bu6LN3wFdLO/,Which Public Values ​​can we serve when sharing data in future cities? 
3/6/2019,0,20,0,https://www.instagram.com/p/Buq2i7nFjaw/,"Can games be used as tools to help us tackle wicked problems ?! Join us on March 21st and 22nd for a special Digital Camp, organized together with Fields of View where we will focus on the topic of immigration and designing tools for multi-cultural spaces. Link in bio."
3/1/2019,0,35,1,https://www.instagram.com/p/BudixG5ltqI/,"How to research. Friday workshop at DSS
"
1/29/2019,0,30,0,https://www.instagram.com/p/BtOpK8DBTCI/,
1/29/2019,0,20,0,https://www.instagram.com/p/BtOlJ3ehv29/,Big brother is judging you. Tonight at De Balie 
1/8/2019,186,0,1,https://www.instagram.com/p/BsYa8pNoyOu/,This is Pierre. He dropped the mic and some serious knowledge about different technologies from space at Mic Drop # 7 ! Tomorrow we welcome Bas van de Poel; “What happens when almost everyone and everything on the planet is digitally connected?”. Dont miss this one 🚀PS: at 17.00h we cheer on the New Year! See you tomorrow at Studio HvA? .
1/7/2019,0,36,1,https://www.instagram.com/p/BsVF7EXBNnR/,"Co-create the future of living! Together with housing corporation De Key we invite you to join in our Digital camp to co-create the future of living! We will explore what it means to live and work in the Amsterdam area of ​​the Knowledge Mile, now and in the future. The end result will be presented to housing corporation De Key, who will integrate it into their vision for the area. DETAILS The Digital Camp consists of 4 important days, where you will talk to experts, design and prototype a vision for the area and transfer all gained insights to the partner.* 10 January 1-5pm: Expert Session with key speakers from the area of ​​living and working: Zef Hemel / professor Urban Planning Jacintha Scheerder / futurologist Hans Meyer / founder Zoku * 25-26 January 9.30-5pm: Developing and designing a vision for the area of ​​the Knowledge Mile (with possible stay over in one of its hotels!)* 7 February 2-5pm: Translate session and handover to De Key LOCATION (DAY AND NIGHT!) The camp will take place at the Student Hotel Amsterdam City, Wibautstraat 129. To dive into the context you are designing for, it is even possible to stay over on the night of the 25th!"
1/2/2019,0,33,1,https://www.instagram.com/p/BsIwqcqBNK6/,"The first Mic drop of 2019, don't miss it! On the 9th of January@basvandepoel, creative director of @space10_journal, will have a talk about augmented intelligence! “What will happen when almost everyone and everything on the planet is digitally connected? PS. we'll have a New Years drink beforehand, join us at 5:00 pm! Location: Studio HvA, Eerste Boerhaavestrat 33E 1091 RZ Amsterdam Time: 17.00h - 19.00h Register at http://bit.ly/micdrop9"
12/24/2018,0,34,0,https://www.instagram.com/p/BrxcehjhsIC/,"ou know what we wish for this Xmas and New Year? To shape the change we wish to see, together! Digital Society School wishes you a wonderful Xmas and an awesome new year!"
12/21/2018,0,20,0,https://www.instagram.com/p/Brppll5BiMd/,"Co-create the future of living! Together with housing corporation De Key we invite you to join in our Digital camp to co-create the future of living! We will explore what it means to live and work in the Amsterdam area of ​​the Knowledge Mile, now and in the future. The end result will be presented to housing corporation De Key, who will integrate it into their vision for the area. DETAILS The Digital Camp consists of 4 important days, where you will talk to experts, design and prototype a vision for the area and transfer all gained insights to the partner. * 10 January 1-5pm: Expert Session with key speakers from the area of ​​living and working: Zef Hemel / professor Urban Planning Jacintha Scheerder / futurologist Hans Meyer / founder Zoku * 25-26 January 930-5pm: Developing and designing a vision for the area of ​​the Knowledge Mile (with possible stay over in one of its hotels!) * 7 February 2-5pm: Translate session and handover to De Key LOCATION (DAY AND NIGHT!) The camp will take place at the Student Hotel Amsterdam City, Wibautstraat 129. To dive into the context you are designing for, it is even possible to stay over on the night of the 25th!"
12/20/2018,0,32,2,https://www.instagram.com/p/BrnFKFtFpCo/,Which of these technologies are you currently dealing with in your professional domain? Please help us in shaping the digital society of the future by filling in this questionnaire. Many thanks! bit.ly/monitor18
12/17/2018,5,0,2,https://www.instagram.com/p/BrfZKbFlYQp/,"We'd proudly like you to meet our Digital Society School Ambassadors! In order of appearance, left to right:,Wouter Meys,Robert Overweg,Mick Jongeling,Jurrien Windt,Carlo de Gaetano,Gijs Huisman,Evelien Christiaanse,Margreet Riphagen,Dan Xu,Jacinta Scheerder,Ilaria Zonda,Sander Veenhof,Assia Kraan,Gijs Gootjes,Yuna Song,Emma Beauxis-Aussalet,Ger Baron,Juan-Carlos Goilo,Marco van Hout"
12/10/2018,0,35,6,https://www.instagram.com/p/BrNaQ6BBHp8/,"What is Artificial Intelligence? Come and find out this Wednesday at Studio Hva! We're hosting an introductory session into AI, touching upon thchargee main tech for AI as well as introducing WEKE; machine learning for Java. By the way, it's free of! When: Wednesday 12/12/2018 Location: Studio HvA, Wibautstraat 2-4, Amsterdam Time: 13.00h - 15.00h."
12/6/2018,0,52,1,https://www.instagram.com/p/BrDSRb2FLIZ/,Our 'Digital to Physical' track team representing at the 5th @thingsconams' in Rotterdam!
11/29/2018,0,40,1,https://www.instagram.com/p/BqxE6e_C1fR/,"It's in our DNA to ask the exciting questions… So we do, All day!"
11/23/2018,0,26,1,https://www.instagram.com/p/BqiGCaElapB/,YEAH! This 10 days we hosted: 2 Digital Camps ('Programming R' & Digital / Physical Play) 1 Micdrop 1 Seminar 1 DSS Ambassador dinner The DSS Teamday 2 workshops! 1000 meetings;) Thrilled! This train is going🚃🚋🚃🚋 How we keep up? Good question! We work with a team of people who love what they're doing! You can be part of the community too 💪💪💪 stay tuned and visit our events to get in touch ⚡️ —-In this picture we see the bright Gijs Huisman talking about the 'social touch of technology'! And of course about how we wish you a great weekend;)
11/22/2018,0,17,0,https://www.instagram.com/p/BqfXj4bFVbT/,"Do you remember the first time you went on the internet? By bringing past, present and future we will set preconditions of a fair and sustainable digital future. Apply now for the (free) hands-on workshop for #Millennials #DataWatchers What? Hands-on workshop Who? Millennials: born between 1980-2000 When? December 14, 2018, 19:00 - 21:00 Where? Digital Society School - Amsterdam University of Applied Science Studio HvA, Urban Room Wibautstraat 2-4 1091 GM Amsterdam, Netherlands"
11/20/2018,0,49,3,https://www.instagram.com/p/BqaJf0XFYUk/,"What happens when 'things' get smarter than people? This friday we'll host the 'Internet of People' conference! The Internet of People conference will address aspects of the Internet, the social and societal implications of the Internet of Things, and related topics and technologies. A humanity-centered approach to the digital world, covering design, tech and social sciences"
11/15/2018,0,80,7,https://www.instagram.com/p/BqM3Z4zlZ_j/,"Start programming with R without headache! You will learn to handle datasets and make neat visualizations with just a few lines of code. Within two days, you will be able to inspect datasets, manipulate them, and plot nice graphs to show your results. We will work with datasets related to the green economy. R is a very accessible programming language, so don't be shy! When? Nov 16-17! 09.30h- 17.00h Where? Wibauthuis, Wibautstraat 3b, Amsterdam Register via our Facebook! Or send a DM;) •"
11/13/2018,133,0,1,https://www.instagram.com/p/BqHl1osiHJy/,"Digital Society Mic Drops are inspirational, interactive, provocative talks given by expert researchers and practitioners, on topics that relate to design, tech, societal challenges and how we can make the world a better place by integrating technology more wisely and humanely.
"
11/12/2018,0,30,0,https://www.instagram.com/p/BqFLP_EhJ6-/,"Get ready for another Micdrop! This coming Wednesday we're welcoming Pierre Elie Crouzet, our favorite applied scientist at the@europeanspaceagency! He will talk about how Space Technologies support Earth's sustainable development. You don't want to miss this for sure. Oh, don't forget to register so we'll have some drinks for you too;)."
11/9/2018,0,29,0,https://www.instagram.com/p/Bp9HWl8ikDH/,Have you already laughed today? Monday we're welcoming the Com4Com guys here again after one year in our studio. We'll learn about the power and effectiveness of comedy in the work field! Make sure to check these guys out on www.com4com.website.
11/8/2018,0,23,1,https://www.instagram.com/p/Bp7KhsTlO_P/,"We're very happy to announce that Frank Kresin @fjkresin, has been appointed as Dean Faculty Digital Media & Creative Industries, of the Amsterdam University of Applied Sciences! More info: https://digitalsocietyschool.org/insight"
