Date,Viewcount,Likes,Comments,Post Link,Description
1/15/2021,0,42,0,https://www.instagram.com/p/CKD0FWmFBQI/,Sign up for the Digital Society Showcase in which our teams will show you the prototypes they've built and explain how they contributed to the Digital Transformation of Society and the Sustainable Development Goals. 
10/29/2020,0,16,2,https://www.instagram.com/p/CG7MuAwAwmY/, Yay! This afternoon we organize the Digital Twin webinars. Our last speaker to announce is Amir Sadeghi. Amir is a Surgical Resident at the Erasmus MC in Rotterdam.In the webinar Amir will share PulmoVR with us. A virtual reality and AI based tool that provides thoracic surgeons 3D and realistic views of their patients' specific anatomy for complex and personalized lung surgery. 
10/28/2020,0,18,2,https://www.instagram.com/p/CG4n6KWs2qe/,We can't wait to go live tomorrow with the #DigitalTwin #webinar . Meet Gohar Sargsyan. Gohar will share CGI's view on Digital Twins for different industries and shares practical examples. 
10/27/2020,0,12,2,https://www.instagram.com/p/CG2DNX2gKzN/,"Only 2 days till the webinar Digital Twin a Promising thing? Meet Ger Janssen, department Head Digital Twin@Philips. Ger will share Philips vision on #digitaltwin , combining devices, systems, hospitals and patients. Next to that he will address the current status and challenges to be solved. "
10/25/2020,0,13,2,https://www.instagram.com/p/CGw5japLkiq/,"4 days to go! Meet Ellen ter Gast, Track Ambassador or Digital Twin.In our webinar Ellen will talk about the 'ecology' of #digitaltwins . What kind of species are they? How did they evolve? Are we in control, or do they control us?"
10/23/2020,0,48,1,https://www.instagram.com/p/CGrpIe9sO9d/,6 days on the clock! Meet Mick Youth (@hyperaura). In the Digital Twin seminars Mick will share his research on adversarial design practices to negotiate a sustainable balance between the physical and digital world in the smart city. 
10/21/2020,0,29,1,https://www.instagram.com/p/CGmPJoFMOGZ/,"Digital Twin Webinar in 8 days! ⏱️ Meet@amberjaeslooten, speaker in the free online webinar. Amber works with digital fashion design, the body and 3D animation. As the first to graduate with a full digital collection back in 2016 her work always questions the way in which we will fit, purchase and wear clothing in the future. She is a co-founder and creative director of The Fabricant, a digital fashion house that creates clothing that is always digital, never physical. Unconstrained by the boundaries of the physical realm, they create intriguing and seductive 3D fashion experiences of endless possibility. "
10/19/2020,0,20,2,https://www.instagram.com/p/CGh3QSOsdGU/,"Do you know what a Digital Twin is? 👬 In 2019, global research and advisory company Gartner listed Digital Twin as a key strategic technology trend. The idea of ​​a digital twin, a virtual representation of an object, a person or processes, is not new. But the application of advanced big data analytics and AI might turn it into a truly disruptive technology. What happens when digital twins are linked to the real world, real people, real processes real time for monitoring and control? ✔️Will we be in control, or will digital twins control us? ✔️How do we interact with digital twins? ✔️Who will be using the technology and for what purposes? ✔️Which companies are the driving forces behind the Digital Twin technology? ✔️How can we develop Digital Twins that will make the world a better place? ✔️How can we use Digital Twin technology to reach the UN sustainable development goals? These questions are underlying the new DSS track, Digital Twin. 🎉 Celebrate the launch of this new track with us with the Digital Twin webinar on Thursday 29 Oct 2020 16:00 - 17:30 CEST. Register yourself for free via #linkinbio ! 😍 See you there?"
10/2/2020,0,45,0,https://www.instagram.com/p/CF1W8uUFaMm/,
9/22/2020,226,0,0,https://www.instagram.com/p/CFcKqhel6Sc/,During a makers you turn ideas into prototypes. Of course that protype doesn't need to be perfect. The goal is a minimum viable product that's a conversation starter. In this video you see team Open Up from the track Systems for Sharing in action!
9/21/2020,0,68,0,https://www.instagram.com/p/CFZk4iAFBPg/,Thank you all so much for contributing to the fifth edition of the #globalgoalsjam ! We are impressed by all the pictures your shared with us from all over the world. Thanks to our amazing community!
9/18/2020,154,0,2,https://www.instagram.com/p/CFRYad0lldU/,"Let the Global Goals Jam 2020 begin!This weekend on Friday September 18 and Saturday September 19 it's the 5th edition of the #globalgoalsjam . The founders, Gijs and Marco, are very excited to kick-off the 2020 Jam with you .. We are looking forward to see all the results of this year. Have fun and make it a good one! :-)"
9/15/2020,324,0,2,https://www.instagram.com/p/CFJ0wp8FFz_/,
9/8/2020,0,46,1,https://www.instagram.com/p/CE4J4VuFtEV/,Creating new tutorials for blended learning: webinars & live events with MSTeams
9/3/2020,209,0,2,https://www.instagram.com/p/CEq3g0YB4Jl/,Throwback Thursday! Two years ago was the official launch of Digital Society School. We're very grateful to everyone who joined one of our events or worked together with us. Only together we can make positive impact on our world with Digital Transformation and prototyping as powerful tools!
8/27/2020,0,19,1,https://www.instagram.com/p/CEY17acnDU7/,"From Austria, France, to the Netherlands and everywhere around! We have teamed up with@hogeschoolvanamsterdam and @tw1n_euto energize dual career services for athletes in the EU. Together, we are developing STARTING 11 - the first ever European Dual Career Toolkit! Check out the our website via our bio to learn more. 😎"
8/25/2020,0,32,1,https://www.instagram.com/p/CEUS0rzALCP/, Job alert! We're looking for a hands-on digital design intern to help us drive our brand forward! Interested? Check out the opening on our website. 👉 Link in bio!
8/20/2020,0,32,1,https://www.instagram.com/p/CEG0XL7gyKq/,"Is the Digital Society School only for young people? No, of course not. We believe in #lifelonglearning . So whether you are 20, 50, 80 years old or somewhere in between: you are very welcome to join our community"
8/13/2020,0,60,1,https://www.instagram.com/p/CD0yzIPAibk/,"In one month it's time for the #GlobalGoalsJam 2020! Friday September 18 and Saturday September 19 you are welcome to join our online Amsterdam Jam. We can't make it a live event as on this picture of last year, but we promise you the online jam is also very meaningful and powerful. Buy your tickets via our website (link in bio)."
8/6/2020,0,57,3,https://www.instagram.com/p/CDixO1unaaO/,"Wow, already one year ago we opened our new location at @Marineterreinamsterdam. 😅 Time flies, when you're having fun!"
7/30/2020,0,29,1,https://www.instagram.com/p/CDixO1unaaO//,"The Digital Society School Design Method Toolkit enables you to get started and enrich your design process. A collection of design and research methods: categorized to help you select, time based to help you plan. Plan and execute your design research, ideation, experimentation and creation within short iterations.Did you already know we have a printed version you can buy ánd an online version you can use free of charge? Check it out on toolkits.dss.cloud"
7/21/2020,0,19,0,https://www.instagram.com/p/CC5rkn7lBc0/,"Repost @greenofficehva It might be summer break, but @digitalsocietyschoolis relentless! Join them for a mini jam to help save our seas! Sign up via the link in the bio of@fabcafekl"
7/16/2020,126,0,1,https://www.instagram.com/p/CCtE6UiFXLT/,Digital Society Showcase Summer 2020 Last June we organized our first totally online Digital Society Showcase In 20 weeks the trainees of Digital Society School worked in multidisciplinary teams on developing a working prototype in collaboration with our project partners. During the showcase the teams will show you the prototypes and explain how they contribute to the Digital Transformation of Society and the Sustainable Development Goals. We are proud of everyone who made this fully online showcase possible! 
7/9/2020,0,36,3,https://www.instagram.com/p/CCas0ddlxHY/,For all of you that ordered our Design Method Toolkit: keep an eye on your mailbox! Thank you for staying patient during this COVID-19. BONUS: We sent everyone an original Digital Society School goodie bag along. Thanks so much - and happy holidays!
6/18/2020,209,0,1,https://www.instagram.com/p/CBkXxM-lmRc/,"Are you ready for showcase # 2 ? Luckily Pari (@mana_papillon) is! 😁 We really enjoyed to see all the participants and project prototypes yesterday. In case you missed it: the doors are still open. You are welcome to join us online today at 10:00 CET. That's in less than half an hour, so go to the link in our bio quickly and register 😍. See you there!"
6/17/2020,0,31,0,https://www.instagram.com/p/CBiC4zXFclP/,Also today: webinar online didactics. We start at 12:00! Free for everyone to view via bit.ly/hva- didactics. Will we see you there? 
6/17/2020,0,26,0,https://www.instagram.com/p/CBh7Af_Fha2/,The booths are ready! Here's a little #sneakpeak . Join our showcase this afternoon 15:00 CET or tomorrow 10:00 CET to learn more about digital transformation 🙌🏼. Register via link in bio.
6/16/2020,0,15,0,https://www.instagram.com/p/CBfnN8mF4WY/,"Posted @withregram • @auas.amsterdamCurious about sustainability at the AUAS? In the recent SustainaBul 2020 ranking of sustainable universities (HBO), AUAS improved its score, placing third in the 'best practices' category with examples like the international #globalgoalsjam , organized by our@digitalsocietyschool. Want to know how students contribute to sustainability at AUAS? Follow the account@auasustainable! Our AUAS sustainability ambassadors will inspire you to make our university and your own lives greener."
6/15/2020,230,0,1,https://www.instagram.com/p/CBc4HkUFFw6/,Yessss. This week it's showtime on Wednesday and Thursday! Do you want to see prototypes linked to meaningful projects? Join us online this Wednesday afternoon or Thursday morning. You won't be disappointed 😁. Register via the link in bio
6/10/2020,0,29,1,https://www.instagram.com/p/CBQVyfClBNA/,Profile picture of digital society school digitalsocietyschool You are invited to join our showcase next week! This time we are more digital than ever. Join us on Wednesday afternoon or on Thursday morning via the interactive platform of Hopin. 
6/9/2020,0,24,0,https://www.instagram.com/p/CBNePNSllml/,"Repost • @be.wasteless🎁Get a chance of winning a reward! 🔹Sometimes when we go shopping we want to take the product out of its wrapping and leave the package there because it is really so useless! Have you ever had the same feeling? 🔺WasteLess invites you to this challenge. Next time you go shopping and face one of those products, take a picture (or selfie if you like) and post it with the hashtag #wasteless_challenge, Your name may be drawn as the winner at the end of June 2020. 🤩 Yes, you may win a prize for this! 🎁🔸More details:1. You can share the picture on a post and / or on the story of your Instagram. If you share it on the story please also mention@be.wastelessso that we don't miss your story 2. If your account is not public, send us your picture in direct message"
6/2/2020,0,18,0,https://www.instagram.com/p/CA7T1x1AY1k/,"Last week we welcomed our new colleague, Jadine. She's our Business Development Manager. Welcome on board! ⛵️""I really like bringing people together. It energizes me to develop people and contact organizations and people for a better world. Prefer doing that in an innovative setting."""
5/28/2020,224,0,7,https://www.instagram.com/p/CAvETTCl4v9/,Wow! Digital Wildlife at@marineterreinamsterdam! 💚 Do you want to try this at home? Just google the animal on a smartphone and click on the 3D animal. 
5/20/2020,0,24,2,https://www.instagram.com/p/CAZ4-TeAya_/,"Oh yes! Today is the big day of our online webinar Responsible Design. 5:00 PM - 6:30 PM CEST. 👉🏻 Sign up via link in bio. The webinar is available world wide for free, the only thing you need is the internet.@olinaterziis ready for it! The opening statements will be done by the dean of the Faculty of Digital Media and Creative Industries, Frank Kresin. Next to Frank Kresin, three other experts will share their perspective on Responsible Design in these times of radical transformation: Theo Ploeg, Olina Terzi and Peter-Paul Verbeek. We will end with a panel discussion with all 4 speakers and the audience, led by Marco Van Hout, creative director of Digital Society School. "
5/18/2020,0,22,0,https://www.instagram.com/p/CAVVlD2suCq/,"Wow! More than 333 people are joining our online webinar already about 'Responsible Design' on May 20th, 5:00 PM - 6:30 PM CEST. Wanna join the group? 👉🏻 Join us by registering via #linkinbio .The opening statements will be done by the dean of the Faculty of Digital Media and Creative Industries, Frank Kresin. Next to Frank Kresin, three other experts will share their perspective on Responsible Design in these times of radical transformation: Theo Ploeg , Olina Terzi and Prof. Dr. Peter-Paul Verbeek. We will end with a panel discussion with all 4 speakers and the audience, led by Marco van Hout, creative director of Digital Society School. ⠀⠀"
5/12/2020,0,38,0,https://www.instagram.com/p/CAFo5eYlPX8/,"On May 20th, 17:00 - 18:30 CEST we are inviting you to join our online webinar on 'Responsible Design' with Theo Ploeg: neo-accelerationist, design + media sociologist.Next to Theo Ploeg, two other experts will share their perspective on Responsible Design in these times of radical transformation: Prof. Verbeek and@olinaterzi. The opening statements will be done by the dean of the Faculty of Digital Media and Creative Industries,@fjkresin. We will end with a panel discussion with all 4 speakers and the audience, led by@houtmarco, creative director of Digital Society School. "
5/6/2020,0,26,0,https://www.instagram.com/p/B_2gl0rlnT7/,"In these times when the global creative community is being asked by the United Nations to take responsibility and 'design our way out of the Corona crisis', it is especially important to have a very clear understanding of what that means. On May 20th, 17:00 - 18:30 CEST we are inviting you to join our online webinar on 'Responsible Design' with keynote speaker and well-known expert in #ethics and #philosophy of #technology , Prof. Dr.@ppverbeek.Next to Prof. Verbeek, two other experts will share their perspective on Responsible Design in these times of radical transformation: Theo Ploeg and@olinaterzi. The opening statements will be done by the dean of the Faculty of Digital Media and Creative Industries,@fjkresin. We will end with a panel discussion with all 4 speakers and the audience, led by@houtmarco, creative director of Digital Society School. "
4/24/2020,161,0,2,https://www.instagram.com/p/B_XVAJQAoxS/,"Before you start your weekend, check out this vacancy please. We can't make the digital transformation of society without you! As a Software Developer (0.6 fte) you are part of the instruments team of the Digital Society School. Your role is to develop, implement and maintain tools and instruments, to work on projects with our partners and to improve the way we work, play and learn together. "
4/3/2020,0,20,1,https://www.instagram.com/p/B-g71XmA2im/,"We are so proud of all people switching their daily work from the office to online remote working! We are grateful to inspire already 150 teachers with our Online Education Training. Because of the success, we opened an extra cohort starting April 13. Would you like to enhance your teaching practice online? Find the link in our bio"
4/1/2020,0,29,0,https://www.instagram.com/p/B-b6addoQNg/,When we were still able to go outside ... • repost from @be.wastelessGroup dinner for finishing our sprint 1 successfully
3/27/2020,187,0,4,https://www.instagram.com/p/B-OxizFlxCh/,This morning we go live with the online Tony's Talk!😍@ynzovanzantenshares with us his view on why the world needs unusual chocolate in unusual times 🍫The livestream starts today at 11:30 AM CET. Link in bio.
3/24/2020,264,0,0,https://www.instagram.com/p/B-H1ZZgF5fy/,Suddenly we were all supposed to work from home. Of course for an organization called The Digital Society School that shouldn't be a big problem. 😂 Are you curious how our home offices look like? Count the cats!
3/23/2020,0,58,2,https://www.instagram.com/p/B-Eo7qtlx3O/,Dear followers. How are you doing? Stay strong in this difficult times! Thanks to@patricia.woudafor this wonderful piece of art
3/10/2020,142,0,1,https://www.instagram.com/p/B9jrgvXF7q5/,[Aftermovie] Critical Data Camp - Growing disruptive bots Together with Imagination of Things we organized the workshop Growing disruptive bots. It was a big success! Curious about what bots we worked on? It's all in the video :-)
3/10/2020,0,16,1,https://www.instagram.com/p/B9jeQTWlRSX/,"It's the National Meat-free Week in Holland. Per person we save 130 liters of water, 770 grams of meat, and the CO2 emissions of 76 kilometers of car driving. 💚 Join us, for a better world!"
3/6/2020,208,0,1,https://www.instagram.com/p/B9ZNK8lFDn4/,The Hogeschool van Amsterdam (HvA) is looking for a Business Developer / Sales Manager Digital Society School (0.8 FTE) for the Digital Society School of the Faculty of Digital Media and Creative Industry .
2/21/2020,99,0,0,https://www.instagram.com/p/B81H8rtIlmS/,"Join our workshop on from the 28th of february to the 1st of march on creating disruptive bots for your cause, product or research. A wildlife workshop. Discount codes available on request. https://buff.ly/352uUO8 🤖@imaginationOfthings"
2/20/2020,0,21,0,https://www.instagram.com/p/B8wp6MalURX/,
2/19/2020,120,0,0,https://www.instagram.com/p/B8v-WgGgkDs/,"Join our workshop on from the 28th of february to the 1st of march on creating disruptive bots for your cause, product or research. A wildlife workshop. Discount codes available on request. https://buff.ly/352uUO8 🤖@imaginationOfthings"
2/19/2020,134,0,1,https://www.instagram.com/p/B8vnbhOFiSJ/,Digital Society Showcase early 2020 - Extended version Hooray! The extended movie of our recent showcase is here. Don't forget to check the bloopers in the end ;-). Where changes takes ... 
2/17/2020,145,0,0,https://www.instagram.com/p/B8q0w5ij5xt/,"Join our workshop on from the 28th of february to the 1st of march on creating disruptive bots for your cause, product or research. A wild workshop. Discount codes available on request. https://buff.ly/352uUO8 🤖 @imaginationOfthings"
2/13/2020,109,0,0,https://www.instagram.com/p/B8ghlYFg_He/,"Join our workshop on from the 28th of february to the 1st of march on creating disruptive bots for your cause, product or research. A wild workshop. Discount codes available on request. https://buff.ly/352uUO8 🤖"
2/10/2020,128,0,0,https://www.instagram.com/p/B8Y-DIfBPvh/,"Join our workshop on from the 28th of february to the 1st of march on creating disruptive bots for your cause, product or research. A wildlife workshop."
2/6/2020,0,44,0,https://www.instagram.com/p/B8OmmE6lxm8/,On this beautiful day we sit together with our wonderful team to sharpen our mission and vision and define the goals for this year 💥
2/3/2020,0,39,0,https://www.instagram.com/p/B8GUo0hlnBo/,Ready for a new semester? We are! 🎉 Today is the kickoff of our 20 week Traineeship. We welcome all the trainees in the@mirrorcentrethis week.
1/31/2020,198,0,0,https://www.instagram.com/p/B7-wK2DFaE3/,"Wow! Did you also like to showcase so much? Here's the first aftermovie. So proud of the results and happy with the good vibes. We don't talk about transformation, but show you what it is! "
1/31/2020,0,18,1,https://www.instagram.com/p/B7-oDIOFEQQ/,Coffee to go with our own glasses
1/30/2020,0,31,0,https://www.instagram.com/p/B78IIzCAar9/,"By 2050, the global population is expected to grow to nearly 10 billion. Two-thirds of them are going to be living in cities. Today, about 54% of the world population lives in cities, and about 66% are expected in 2050.This creates a significant challenge in providing global urban populations with sufficient food in a sustainable way. The current agricultural system is not able to meet such a big incremented in food request. "
1/29/2020,0,35,0,https://www.instagram.com/p/B75jV2igS3X/,Did you know you eat roughly a credit card's worth of microplastic every week ?! The issue of microplastic is now a global epidemic. What if the only way to manage this problem was to eat all this plastic ourselves? Check out this awesome prototype of@waste.2.worth! :)
1/28/2020,0,33,0,https://www.instagram.com/p/B73S1GYFKZc/,The laptop of our colleague Anneke is well received! 😁 Thanks for the nice
1/23/2020,0,70,0,https://www.instagram.com/p/B7qe4DPlXdi/,"Oh what a night! 😍 Looking back on a great Showcase, with amazing visitors, partners, projects and trainees. It was so hard to make a small selection of all the amazing pictures (thanks@bveth). More pictures and the aftermovie are expected next week"
1/22/2020,0,47,0,https://www.instagram.com/p/B7oMoqVlnpv/,Full house! Let's start the showcase and have fun
1/22/2020,0,28,2,https://www.instagram.com/p/B7nVFziltn4/,Today is the big day. Showcase time! We can't wait to see you this afternoon at Studio HvA!
1/21/2020,145,0,2,https://www.instagram.com/p/B7k9Ac2BOEp/,How can we provide safer abuse-free cyberspaces for journalists with the help of conversational agents?Tomorrow is our showcase and we can't wait to show you the results! Register via link in bio.
1/20/2020,120,0,1,https://www.instagram.com/p/B7iYNvLBtyS/,"How can we design solutions for the urban environment that activate citizens to help create green urban spaces where pollinators can thrive?With the rise of the population expected to be living in cities in 2030, the urban environment needs to be designed to be sustainable and livable for all the cohabiting organisms.Discover the outcomes of this project at our Showcase. January 22, Studio HvA. Link in bio."
1/17/2020,137,0,1,https://www.instagram.com/p/B7bg2Y5FZzd/,"How can we create open and accessible datasets that tells the story of the young climate movements, and at the same time function as an interface in support of climate action?How can we work towards a protest-lab where people can join the climate movement, by creating their own data-driven and street-ready dreams of better futures?Join our Digital Society Showcase to interact with our prototypes. 22 January, Studio HvA. Check the link in our bio."
1/15/2020,137,0,1,https://www.instagram.com/p/B7VgPj4IS9Z/,"How can modern technology democratize knowledge and transform museum education? In the era of a digital age, time and information became two of the most valuable capitals. At a time when people can flick a keyboard or swipe a touchscreen to connect with products, people, and information from anywhere in the world, the creation of an inclusive online community for educational purposes becomes a necessity.Find out about the project on our Digital Society Showcase! 22 January, Studio HvA. Register via link in bio."
1/15/2020,139,0,1,https://www.instagram.com/p/B7UGuONAPGN/,"How can we design transparent and personalized governmental services for a digital age? In the last decade an unprecedented digital transformation is taking place in the field of government technology (GovTech), leading not only to the digitation of traditionally offline services, but also to heated debates around privacy and access to data. How can citizens benefit from personalized services free of bureaucratic impediments, while engaging with digital processes they can trust?Visit our Digital Society Showcase, 22 January, Studio HvA. Register via link in bio."
1/13/2020,193,0,1,https://www.instagram.com/p/B7QWo0OHeiI/,"With the addition of digital technology, printed media can offer new experiences and fully adjust to the reader. How can we enhance physical printing with sustainable technology?Feel welcome at our showcase, 22 January, Studio HvA. Link in bio."
1/10/2020,136,0,1,https://www.instagram.com/p/B7IoP03Fdco/,"How might we learn about our potential audiences by using 'social listening' in order to be more inclusive of a younger generation who are not already at the ArenA, and create an adaptive and future-proof venue? Find it out on our showcase ! :) You are invited to join us on January 22. Link in bio."
1/9/2020,168,0,1,https://www.instagram.com/p/B7Ep9zFp8u4/,How can we change the behavior in waste management at the Universities of Amsterdam The University of Amsterdam (UvA) & Hogeschool van Amsterdam (HvA) have the ambition to become the most sustainable universities in terms of resource management and want to adhere to the Amsterdam goal of becoming the frontrunner in the circular economy by 2024.Discover the outcomes of our project at our showcase on January 22. Link in bio!
1/7/2020,6,0,1,https://www.instagram.com/p/B7BNWE0DLTy/,JUSTICE IN THE DIGITAL SOCIETY What are digital transformation opportunities in forensic mental health care practice? Discover it at our showcase on January 22! Link in bio.
1/6/2020,0,29,1,https://www.instagram.com/p/B6_MHFUlLzK/,Start the countdown! Only 2.5 more weeks till the Digital Society Showcase. Are you in to check out the amazing prototypes of this semester? Register via the link in bio.
1/1/2020,0,19,1,https://www.instagram.com/p/B6yUIRdFcl4/,Happy New Year! What is your goal for 2020? Do we see you in one of our courses this year? 
